{
  "schemaVersion": 8,
  "filters": {
    "activeCount": 0
  },
  "pagination": {
    "activeCount": 0,
    "expressionOffset": 0,
    "typeOffset": 0,
    "statementOffset": 0,
    "resourceOffset": 0,
    "expressionTotalCount": 0,
    "expressionEmittedCount": 0,
    "expressionHasMore": false,
    "expressionNextOffset": 0,
    "typeTotalCount": 0,
    "typeEmittedCount": 0,
    "typeHasMore": false,
    "typeNextOffset": 0,
    "statementTotalCount": 0,
    "statementEmittedCount": 0,
    "statementHasMore": false,
    "statementNextOffset": 0,
    "resourceTotalCount": 5,
    "resourceEmittedCount": 5,
    "resourceHasMore": false,
    "resourceNextOffset": 5
  },
  "categoryCounts": {
    "expressionTotalCount": 0,
    "typeTotalCount": 0,
    "statementTotalCount": 0,
    "resourceTotalCount": 5,
    "recordTotalCount": 5,
    "expressionKinds": [],
    "statementKinds": [],
    "typeOwnerKinds": [],
    "resourceRecordKinds": [
      {
        "name": "access",
        "count": 1
      },
      {
        "name": "binding",
        "count": 1
      },
      {
        "name": "declaration",
        "count": 1
      },
      {
        "name": "layout",
        "count": 1
      },
      {
        "name": "set",
        "count": 1
      }
    ],
    "resourceKinds": [
      {
        "name": "buffer",
        "count": 5
      }
    ]
  },
  "records": {
    "enabled": true,
    "activeCount": 1,
    "offset": 0,
    "totalCount": 5,
    "emittedCount": 5,
    "hasMore": false,
    "nextOffset": 5,
    "items": [
      {
        "cursor": 0,
        "recordKind": "resource",
        "resource": {
          "index": 1,
          "resourceRecordKind": "layout",
          "stage": "compute",
          "entryPoint": "main",
          "resourceName": "values",
          "resourceKind": "buffer",
          "type": "float*",
          "bindingSet": 2,
          "binding": 3,
          "location": {
            "file": "resource.cgl",
            "line": 4,
            "column": 5,
            "offset": 100,
            "length": 29,
            "endLine": 4,
            "endColumn": 34,
            "endOffset": 129
          }
        }
      },
      {
        "cursor": 1,
        "recordKind": "resource",
        "resource": {
          "index": 0,
          "resourceRecordKind": "declaration",
          "stage": "compute",
          "entryPoint": "main",
          "resourceName": "values",
          "resourceKind": "buffer",
          "type": "float*",
          "bindingSet": 2,
          "binding": 3,
          "location": {
            "file": "resource.cgl",
            "line": 4,
            "column": 5,
            "offset": 100,
            "length": 55,
            "endLine": 4,
            "endColumn": 60,
            "endOffset": 155
          }
        }
      },
      {
        "cursor": 2,
        "recordKind": "resource",
        "resource": {
          "index": 2,
          "resourceRecordKind": "set",
          "stage": "compute",
          "entryPoint": "main",
          "resourceName": "values",
          "resourceKind": "buffer",
          "type": "float*",
          "bindingSet": 2,
          "binding": 3,
          "location": {
            "file": "resource.cgl",
            "line": 4,
            "column": 12,
            "offset": 107,
            "length": 7,
            "endLine": 4,
            "endColumn": 19,
            "endOffset": 114
          }
        }
      },
      {
        "cursor": 3,
        "recordKind": "resource",
        "resource": {
          "index": 3,
          "resourceRecordKind": "binding",
          "stage": "compute",
          "entryPoint": "main",
          "resourceName": "values",
          "resourceKind": "buffer",
          "type": "float*",
          "bindingSet": 2,
          "binding": 3,
          "location": {
            "file": "resource.cgl",
            "line": 4,
            "column": 21,
            "offset": 116,
            "length": 11,
            "endLine": 4,
            "endColumn": 32,
            "endOffset": 127
          }
        }
      },
      {
        "cursor": 4,
        "recordKind": "resource",
        "resource": {
          "index": 4,
          "resourceRecordKind": "access",
          "stage": "compute",
          "entryPoint": "main",
          "resourceName": "values",
          "resourceKind": "buffer",
          "function": "main",
          "type": "float",
          "bindingSet": 2,
          "binding": 3,
          "accessKind": "read",
          "accessPath": "values[index]",
          "operation": "load",
          "indexExpression": "index",
          "location": {
            "file": "resource.cgl",
            "line": 8,
            "column": 12,
            "offset": 180,
            "length": 6,
            "endLine": 8,
            "endColumn": 18,
            "endOffset": 186
          }
        }
      }
    ]
  },
  "hirSourceLocations": {
    "expressionCount": 0,
    "expressionWithLocationCount": 0,
    "typeCount": 0,
    "typeWithLocationCount": 0,
    "statementCount": 0,
    "statementWithLocationCount": 0,
    "resourceCount": 5,
    "resourceWithLocationCount": 5,
    "expressions": [],
    "types": [],
    "statements": [],
    "resources": [
      {
        "index": 0,
        "resourceRecordKind": "declaration",
        "stage": "compute",
        "entryPoint": "main",
        "resourceName": "values",
        "resourceKind": "buffer",
        "type": "float*",
        "bindingSet": 2,
        "binding": 3,
        "location": {
          "file": "resource.cgl",
          "line": 4,
          "column": 5,
          "offset": 100,
          "length": 55,
          "endLine": 4,
          "endColumn": 60,
          "endOffset": 155
        }
      },
      {
        "index": 1,
        "resourceRecordKind": "layout",
        "stage": "compute",
        "entryPoint": "main",
        "resourceName": "values",
        "resourceKind": "buffer",
        "type": "float*",
        "bindingSet": 2,
        "binding": 3,
        "location": {
          "file": "resource.cgl",
          "line": 4,
          "column": 5,
          "offset": 100,
          "length": 29,
          "endLine": 4,
          "endColumn": 34,
          "endOffset": 129
        }
      },
      {
        "index": 2,
        "resourceRecordKind": "set",
        "stage": "compute",
        "entryPoint": "main",
        "resourceName": "values",
        "resourceKind": "buffer",
        "type": "float*",
        "bindingSet": 2,
        "binding": 3,
        "location": {
          "file": "resource.cgl",
          "line": 4,
          "column": 12,
          "offset": 107,
          "length": 7,
          "endLine": 4,
          "endColumn": 19,
          "endOffset": 114
        }
      },
      {
        "index": 3,
        "resourceRecordKind": "binding",
        "stage": "compute",
        "entryPoint": "main",
        "resourceName": "values",
        "resourceKind": "buffer",
        "type": "float*",
        "bindingSet": 2,
        "binding": 3,
        "location": {
          "file": "resource.cgl",
          "line": 4,
          "column": 21,
          "offset": 116,
          "length": 11,
          "endLine": 4,
          "endColumn": 32,
          "endOffset": 127
        }
      },
      {
        "index": 4,
        "resourceRecordKind": "access",
        "stage": "compute",
        "entryPoint": "main",
        "resourceName": "values",
        "resourceKind": "buffer",
        "function": "main",
        "type": "float",
        "bindingSet": 2,
        "binding": 3,
        "accessKind": "read",
        "accessPath": "values[index]",
        "operation": "load",
        "indexExpression": "index",
        "location": {
          "file": "resource.cgl",
          "line": 8,
          "column": 12,
          "offset": 180,
          "length": 6,
          "endLine": 8,
          "endColumn": 18,
          "endOffset": 186
        }
      }
    ]
  }
}
